{
  "$schema": "https://json-schema.org/draft/2020-12/schema",
  "title": "Roadmap item",
  "type": "object",
  "required": [
    "id",
    "title",
    "type",
    "status",
    "theme",
    "outcome",
    "blockedBy",
    "blocks",
    "dependencies",
    "tags",
    "labels"
  ],
  "properties": {
    "id": {
      "type": "string",
      "minLength": 1
    },
    "title": {
      "type": "string",
      "minLength": 1
    },
    "type": {
      "type": "string"
    },
    "status": {
      "type": "string"
    },
    "triage": {
      "const": "untriaged"
    },
    "order": {
      "type": "integer",
      "minimum": 1
    },
    "parent": {
      "type": "string",
      "minLength": 1,
      "pattern": "\\S"
    },
    "theme": {
      "type": "string",
      "minLength": 1
    },
    "outcome": {
      "type": "string",
      "minLength": 1
    },
    "size": {
      "type": "string",
      "enum": [
        "XS",
        "S",
        "M",
        "L",
        "XL"
      ]
    },
    "scoring": {
      "type": "object",
      "required": [
        "reach",
        "impact",
        "confidence",
        "effort"
      ],
      "properties": {
        "reach": {
          "type": "number",
          "minimum": 0
        },
        "impact": {
          "type": "number",
          "minimum": 1,
          "maximum": 5
        },
        "confidence": {
          "type": "number",
          "minimum": 0.1,
          "maximum": 1
        },
        "effort": {
          "type": "number",
          "exclusiveMinimum": 0
        }
      }
    },
    "dependencies": {
      "type": "array",
      "items": {
        "type": "string"
      },
      "uniqueItems": true
    },
    "blockedBy": {
      "type": "array",
      "items": {
        "type": "string"
      },
      "uniqueItems": true
    },
    "blocks": {
      "type": "array",
      "items": {
        "type": "string"
      },
      "uniqueItems": true
    },
    "tags": {
      "type": "array",
      "items": {
        "type": "string"
      },
      "uniqueItems": true
    },
    "labels": {
      "type": "array",
      "items": {
        "type": "string"
      },
      "uniqueItems": true
    },
    "sources": {
      "type": "array"
    },
    "integrations": {
      "type": "object",
      "properties": {
        "github": {
          "type": "object",
          "properties": {
            "issue": {
              "oneOf": [
                {
                  "type": "integer",
                  "minimum": 1
                },
                {
                  "const": "create"
                }
              ]
            },
            "repository": {
              "type": "string",
              "pattern": "^(?![^/]*--)[A-Za-z0-9](?:[A-Za-z0-9-]{0,37}[A-Za-z0-9])?/(?!\\.{1,2}$)[A-Za-z0-9_.-]{1,100}$"
            },
            "nodeId": {
              "type": "string",
              "minLength": 1,
              "pattern": "\\S"
            },
            "previousLocations": {
              "type": "array",
              "items": {
                "type": "object",
                "required": [
                  "repository",
                  "issue"
                ],
                "properties": {
                  "repository": {
                    "type": "string",
                    "pattern": "^(?![^/]*--)[A-Za-z0-9](?:[A-Za-z0-9-]{0,37}[A-Za-z0-9])?/(?!\\.{1,2}$)[A-Za-z0-9_.-]{1,100}$"
                  },
                  "issue": {
                    "type": "integer",
                    "minimum": 1
                  }
                },
                "additionalProperties": false
              },
              "uniqueItems": true
            },
            "previousNodeIds": {
              "type": "array",
              "items": {
                "type": "string",
                "minLength": 1,
                "pattern": "\\S"
              },
              "uniqueItems": true
            }
          },
          "additionalProperties": false,
          "allOf": [
            {
              "if": {
                "required": [
                  "issue"
                ],
                "properties": {
                  "issue": {
                    "const": "create"
                  }
                }
              },
              "then": {
                "not": {
                  "anyOf": [
                    {
                      "required": [
                        "nodeId"
                      ]
                    },
                    {
                      "required": [
                        "previousLocations"
                      ]
                    },
                    {
                      "required": [
                        "previousNodeIds"
                      ]
                    }
                  ]
                }
              }
            }
          ],
          "dependentRequired": {
            "repository": [
              "issue"
            ],
            "nodeId": [
              "issue"
            ],
            "previousLocations": [
              "issue"
            ],
            "previousNodeIds": [
              "issue"
            ]
          }
        }
      }
    }
  },
  "allOf": [
    {
      "if": {
        "required": [
          "triage"
        ],
        "properties": {
          "triage": {
            "const": "untriaged"
          }
        }
      },
      "then": {
        "not": {
          "anyOf": [
            {
              "required": [
                "order"
              ]
            },
            {
              "required": [
                "scoring"
              ]
            }
          ]
        }
      },
      "else": {
        "required": [
          "order",
          "scoring"
        ]
      }
    }
  ]
}
