{
  "$schema": "../schema/roadmap-item.schema.json",
  "id": "RM-139",
  "parent": "RM-141",
  "title": "Evaluate body-only endpoint request contracts",
  "type": "enabler",
  "status": "done",
  "triage": "untriaged",
  "theme": "repo-operations",
  "outcome": "GitHub issue #902 is canonically represented from the reconciliation manifest.",
  "blockedBy": [],
  "blocks": [],
  "dependencies": [],
  "tags": [],
  "labels": [
    "architecture",
    "area: api",
    "research",
    "type: enabler"
  ],
  "sources": [
    {
      "kind": "github-issue",
      "reference": "#902"
    }
  ],
  "integrations": {
    "github": {
      "issue": 902,
      "nodeId": "I_kwDOQAEVW88AAAABIRaJUQ"
    }
  }
}
