{
  "$schema": "../schema/roadmap-item.schema.json",
  "id": "RM-265",
  "parent": "RM-264",
  "title": "[Issue]: Assess typed xUnit v3 trait attributes",
  "type": "enabler",
  "status": "proposed",
  "order": 265,
  "theme": "repo-operations",
  "outcome": "GitHub issue #1108 is canonically represented from the reconciliation manifest.",
  "scoring": {
    "reach": 1,
    "impact": 1,
    "confidence": 0.1,
    "effort": 3
  },
  "blockedBy": [],
  "blocks": [],
  "dependencies": [],
  "tags": [],
  "labels": [
    "research",
    "sharedkernel",
    "testing",
    "type: enabler"
  ],
  "sources": [
    {
      "kind": "github-issue",
      "reference": "#1108"
    }
  ],
  "integrations": {
    "github": {
      "issue": 42,
      "repository": "danigutsch/PandaBear.SharedKernel",
      "nodeId": "I_kwDOVRZZxs8AAAABYqBWUA",
      "previousLocations": [
        {
          "repository": "danigutsch/ViajantesTurismo",
          "issue": 1108
        }
      ]
    }
  }
}
