{
  "$schema": "../schema/roadmap-item.schema.json",
  "id": "RM-238",
  "parent": "RM-234",
  "title": "Enforce actionable NuGet restore and audit findings",
  "type": "enabler",
  "status": "done",
  "triage": "untriaged",
  "theme": "repo-operations",
  "outcome": "GitHub issue #1080 is canonically represented from the reconciliation manifest.",
  "blockedBy": [],
  "blocks": [],
  "dependencies": [],
  "tags": [],
  "labels": [
    ".net",
    "area: tooling",
    "ci",
    "security",
    "type: enabler"
  ],
  "sources": [
    {
      "kind": "github-issue",
      "reference": "#1080"
    }
  ],
  "integrations": {
    "github": {
      "issue": 1080,
      "nodeId": "I_kwDOQAEVW88AAAABI_1Bhg"
    }
  }
}
