{
  "$schema": "../schema/roadmap-item.schema.json",
  "id": "RM-262",
  "parent": "RM-259",
  "title": "Verify endpoint dependencies from composed hosts",
  "type": "issue",
  "status": "done",
  "triage": "untriaged",
  "theme": "repo-operations",
  "outcome": "GitHub issue #1105 is canonically represented from the reconciliation manifest.",
  "blockedBy": [],
  "blocks": [],
  "dependencies": [],
  "tags": [],
  "labels": [
    ".net",
    "area: api",
    "enhancement",
    "testing"
  ],
  "sources": [
    {
      "kind": "github-issue",
      "reference": "#1105"
    }
  ],
  "integrations": {
    "github": {
      "issue": 1105,
      "nodeId": "I_kwDOQAEVW88AAAABJNVfYA"
    }
  }
}
