{
  "$schema": "../schema/roadmap-item.schema.json",
  "id": "RM-304",
  "title": "Standardize deterministic time and temporal semantics",
  "type": "epic",
  "status": "proposed",
  "order": 492,
  "theme": "repo-operations",
  "outcome": "GitHub issue #1131 is canonically represented from the reconciliation manifest.",
  "scoring": {
    "reach": 1,
    "impact": 1,
    "confidence": 0.1,
    "effort": 8
  },
  "blockedBy": [],
  "blocks": [],
  "dependencies": [],
  "tags": [],
  "labels": [
    "architecture",
    "testing",
    "type: epic"
  ],
  "sources": [
    {
      "kind": "github-issue",
      "reference": "#1131"
    }
  ],
  "integrations": {
    "github": {
      "issue": 1131,
      "nodeId": "I_kwDOQAEVW88AAAABJWxopQ"
    }
  }
}
