{
  "$schema": "../schema/roadmap-item.schema.json",
  "id": "RM-087",
  "title": "add operations dashboard for scheduling and messaging health",
  "type": "feature",
  "status": "proposed",
  "order": 448,
  "theme": "repo-operations",
  "outcome": "GitHub issue #772 is canonically represented from the reconciliation manifest.",
  "scoring": {
    "reach": 1,
    "impact": 1,
    "confidence": 0.1,
    "effort": 5
  },
  "blockedBy": [],
  "blocks": [],
  "dependencies": [],
  "tags": [],
  "labels": [
    "enhancement",
    "frontend",
    "management-web",
    "observability",
    "security",
    "type: feature"
  ],
  "sources": [
    {
      "kind": "github-issue",
      "reference": "#772"
    }
  ],
  "integrations": {
    "github": {
      "issue": 772,
      "nodeId": "I_kwDOQAEVW88AAAABH4bffQ"
    }
  }
}
