{
  "$schema": "../schema/roadmap-item.schema.json",
  "id": "RM-231",
  "parent": "RM-230",
  "title": "Add analyzer for governed C# string literals",
  "type": "enabler",
  "status": "proposed",
  "order": 419,
  "theme": "repo-operations",
  "outcome": "GitHub issue #1071 is canonically represented from the reconciliation manifest.",
  "scoring": {
    "reach": 1,
    "impact": 1,
    "confidence": 0.1,
    "effort": 3
  },
  "blockedBy": [],
  "blocks": [],
  "dependencies": [],
  "tags": [],
  "labels": [
    "architecture",
    "area: sharedkernel",
    "area: tooling",
    "configuration",
    "testing",
    "type: enabler"
  ],
  "sources": [
    {
      "kind": "github-issue",
      "reference": "#1071"
    }
  ],
  "integrations": {
    "github": {
      "issue": 1071,
      "nodeId": "I_kwDOQAEVW88AAAABI7YQvg"
    }
  }
}
