{
  "$schema": "../schema/roadmap-item.schema.json",
  "id": "RM-196",
  "parent": "RM-215",
  "title": "Consolidate Branding into Catalog as an independent module",
  "type": "epic",
  "status": "proposed",
  "order": 480,
  "theme": "repo-operations",
  "outcome": "GitHub issue #1009 is canonically represented from the reconciliation manifest.",
  "scoring": {
    "reach": 1,
    "impact": 1,
    "confidence": 0.1,
    "effort": 8
  },
  "blockedBy": [],
  "blocks": [],
  "dependencies": [],
  "tags": [],
  "labels": [
    "architecture",
    "area: api",
    "catalog",
    "infrastructure",
    "risk: breaking-change",
    "security",
    "sharedkernel",
    "type: epic"
  ],
  "sources": [
    {
      "kind": "github-issue",
      "reference": "#1009"
    }
  ],
  "integrations": {
    "github": {
      "issue": 1009,
      "nodeId": "I_kwDOQAEVW88AAAABIiyjSQ"
    }
  }
}
