{
  "$schema": "../schema/roadmap-item.schema.json",
  "id": "RM-016",
  "parent": "RM-009",
  "title": "Consolidate GitHub clients under src",
  "type": "issue",
  "status": "proposed",
  "order": 100,
  "theme": "repo-operations",
  "outcome": "Roadmap projection reuses a focused source-owned GitHub client without changing GitHub issue-body behavior.",
  "size": "M",
  "scoring": {
    "reach": 1,
    "impact": 1,
    "confidence": 0.8,
    "effort": 3
  },
  "blockedBy": [],
  "blocks": [],
  "dependencies": [],
  "tags": [
    "github",
    "projection",
    "client"
  ],
  "labels": [
    "area: tooling"
  ],
  "sources": [
    {
      "kind": "github-issue",
      "reference": "#1030",
      "supports": [
        "scope"
      ]
    },
    {
      "kind": "repository-artifact",
      "reference": "tools/ViajantesTurismo.RepoConfig.Tool/GitHubRoadmapSyncer.cs; tools/ViajantesTurismo.RepoConfig.Tool/GitHubProjectClient.cs",
      "supports": [
        "effort",
        "confidence"
      ]
    },
    {
      "kind": "maintainer-review",
      "reference": "@danigutsch, deterministic-open-leaf-v1 at 63b5dc7, 2026-07-16; review by 2026-07-30",
      "supports": [
        "scope",
        "effort"
      ]
    }
  ],
  "integrations": {
    "github": {
      "issue": 1030
    }
  }
}
