{
  "$schema": "../schema/roadmap-item.schema.json",
  "id": "RM-210",
  "title": "Add analyzer and code fix for conditional ShouldBe assertions",
  "type": "enabler",
  "status": "proposed",
  "order": 237,
  "theme": "repo-operations",
  "outcome": "GitHub issue #1029 is canonically represented from the reconciliation manifest.",
  "scoring": {
    "reach": 1,
    "impact": 1,
    "confidence": 0.1,
    "effort": 3
  },
  "blockedBy": [],
  "blocks": [],
  "dependencies": [],
  "tags": [],
  "labels": [
    ".net",
    "area: sharedkernel",
    "area: testing",
    "enhancement",
    "sharedkernel",
    "testing",
    "type: enabler"
  ],
  "sources": [
    {
      "kind": "github-issue",
      "reference": "#1029"
    }
  ],
  "integrations": {
    "github": {
      "issue": 10,
      "repository": "danigutsch/PandaBear.SharedKernel",
      "nodeId": "I_kwDOVRZZxs8AAAABYqAS5w",
      "previousLocations": [
        {
          "repository": "danigutsch/ViajantesTurismo",
          "issue": 1029
        }
      ]
    }
  }
}
