{
  "$schema": "../schema/roadmap-item.schema.json",
  "id": "RM-122",
  "title": "Define diagram metadata conventions for trust boundaries",
  "type": "enabler",
  "status": "proposed",
  "order": 379,
  "theme": "repo-operations",
  "outcome": "GitHub issue #871 is canonically represented from the reconciliation manifest.",
  "scoring": {
    "reach": 1,
    "impact": 1,
    "confidence": 0.1,
    "effort": 3
  },
  "blockedBy": [],
  "blocks": [],
  "dependencies": [],
  "tags": [],
  "labels": [
    "architecture",
    "area: tooling",
    "documentation",
    "type: enabler"
  ],
  "sources": [
    {
      "kind": "github-issue",
      "reference": "#871"
    }
  ],
  "integrations": {
    "github": {
      "issue": 871,
      "nodeId": "I_kwDOQAEVW88AAAABINN7Mw"
    }
  }
}
