{
  "$schema": "../schema/roadmap-item.schema.json",
  "id": "RM-167",
  "parent": "RM-166",
  "title": "Manage verified travel payment accounts",
  "type": "issue",
  "status": "done",
  "triage": "untriaged",
  "theme": "repo-operations",
  "outcome": "GitHub issue #957 is canonically represented from the reconciliation manifest.",
  "blockedBy": [],
  "blocks": [],
  "dependencies": [],
  "tags": [],
  "labels": [
    "enhancement"
  ],
  "sources": [
    {
      "kind": "github-issue",
      "reference": "#957"
    }
  ],
  "integrations": {
    "github": {
      "issue": 957,
      "nodeId": "I_kwDOQAEVW88AAAABIcucAw"
    }
  }
}
